{
  "$schema": "https://json-schema.org/draft/2020-12/schema",
  "$id": "https://photoflow.local/schemas/component-manifest-v2.schema.json",
  "title": "PhotoFlow Component Manifest V2",
  "type": "object",
  "additionalProperties": true,
  "required": ["apiVersion", "id", "version", "componentHost"],
  "properties": {
    "apiVersion": { "const": 1 },
    "id": { "type": "string", "pattern": "^[A-Za-z0-9][A-Za-z0-9._-]{0,79}$" },
    "version": { "type": "string", "minLength": 1, "maxLength": 80 },
    "icon": { "type": "string", "maxLength": 512 },
    "runtimeContributions": {
      "type": "array", "maxItems": 16,
      "items": {
        "type": "object", "additionalProperties": false,
        "required": ["type", "backendId", "displayName", "backendVersion", "protocolVersion", "transport", "priority", "probe", "features"],
        "properties": {
          "type": { "const": "media.playbackBackend" },
          "backendId": { "$ref": "#/$defs/id" },
          "displayName": { "type": "string", "minLength": 1, "maxLength": 120 },
          "backendVersion": { "type": "string", "pattern": "^(0|[1-9][0-9]*)\\.(0|[1-9][0-9]*)\\.(0|[1-9][0-9]*)(?:-[0-9A-Za-z.-]+)?(?:\\+[0-9A-Za-z.-]+)?$" },
          "protocolVersion": { "const": 1 }, "transport": { "const": "media-playback-backend-v1" },
          "priority": { "type": "integer", "minimum": -1000, "maximum": 1000 },
          "probe": { "type": "object", "additionalProperties": false, "required": ["containers", "codecs", "extensions"], "properties": {
            "containers": { "type": "array", "minItems": 1, "maxItems": 64, "uniqueItems": true, "items": { "type": "string", "pattern": "^[A-Za-z0-9][A-Za-z0-9.+_-]{0,63}$" } },
            "codecs": { "type": "object", "additionalProperties": false, "required": ["video", "audio"], "properties": { "video": { "type": "array", "maxItems": 64, "uniqueItems": true, "items": { "type": "string" } }, "audio": { "type": "array", "maxItems": 64, "uniqueItems": true, "items": { "type": "string" } } } },
            "extensions": { "type": "array", "minItems": 1, "maxItems": 64, "uniqueItems": true, "items": { "type": "string", "pattern": "^\\.[A-Za-z0-9]{1,12}$" } }
          } },
          "features": { "type": "object", "additionalProperties": false, "required": ["transforms", "hdr", "statistics", "subtitles", "hardwareDecoding", "capture"], "properties": {
            "transforms": { "type":"object","additionalProperties":false,"required":["aspectModes","rotation","flip","crop"],"properties":{"aspectModes":{"type":"array","minItems":1,"uniqueItems":true,"items":{"enum":["source","contain","cover","16:9","4:3","1:1"]}},"rotation":{"type":"boolean"},"flip":{"type":"boolean"},"crop":{"type":"boolean"}} },
            "hdr": { "type":"object","additionalProperties":false,"required":["passthrough","toneMapping","algorithms","targetPeakControl"],"properties":{"passthrough":{"type":"boolean"},"toneMapping":{"type":"boolean"},"algorithms":{"type":"array","minItems":1,"uniqueItems":true,"items":{"enum":["auto","bt2390","reinhard","mobius","hable"]}},"targetPeakControl":{"type":"boolean"}} },
            "statistics": { "type":"object","additionalProperties":false,"required":["basic","decode","hdr","timing","cache","gpu","maxUpdateHz"],"properties":{"basic":{"type":"boolean"},"decode":{"type":"boolean"},"hdr":{"type":"boolean"},"timing":{"type":"boolean"},"cache":{"type":"boolean"},"gpu":{"type":"boolean"},"maxUpdateHz":{"type":"number","minimum":0.2,"maximum":4}} },
            "subtitles": { "type":"object","additionalProperties":false,"required":["embedded","external","ass","styles"],"properties":{"embedded":{"type":"boolean"},"external":{"type":"boolean"},"ass":{"type":"boolean"},"styles":{"type":"boolean"}} },
            "hardwareDecoding": { "type":"object","additionalProperties":false,"required":["supported","selectable","softwareFallback"],"properties":{"supported":{"type":"boolean"},"selectable":{"type":"boolean"},"softwareFallback":{"type":"boolean"}} }, "capture": { "type":"object","additionalProperties":false,"required":["sourceFrame","displayedFrame"],"properties":{"sourceFrame":{"type":"boolean"},"displayedFrame":{"type":"boolean"}} }
          } }
        }
      }
    },
    "componentHost": {
      "type": "object",
      "additionalProperties": false,
      "required": ["contractVersion", "compatibility", "contributions", "service"],
      "properties": {
        "contractVersion": { "const": 2 },
        "adoptionGrants": { "type": "array", "maxItems": 2, "uniqueItems": true, "items": { "enum": ["component.storage.previous.v1", "project.output.existing.v1"] } },
        "legacySettingsAdoptions": {
          "type": "array", "maxItems": 8, "uniqueItems": true,
          "items": {
            "type": "object", "additionalProperties": false, "required": ["topLevelKey"],
            "properties": {
              "topLevelKey": { "type": "string", "minLength": 1, "maxLength": 128, "pattern": "^[A-Za-z][A-Za-z0-9]*$" }
            }
          }
        },
        "compatibility": {
          "type": "object",
          "additionalProperties": false,
          "required": ["minHostApiVersion", "maxHostApiVersion"],
          "properties": {
            "minHostApiVersion": { "const": 7 },
            "maxHostApiVersion": { "const": 7 }
          }
        },
        "contributions": {
          "type": "array", "minItems": 2, "maxItems": 32,
          "items": {
            "oneOf": [
              { "type": "object", "additionalProperties": false, "required": ["type", "id", "label", "pageId"], "properties": { "type": { "const": "workspace.toolbarAction" }, "id": { "$ref": "#/$defs/id" }, "label": { "type": "string", "minLength": 1, "maxLength": 80 }, "pageId": { "$ref": "#/$defs/id" } } },
              { "type": "object", "additionalProperties": false, "required": ["type", "id", "title", "entry"], "properties": { "type": { "const": "component.fullPage" }, "id": { "$ref": "#/$defs/id" }, "title": { "type": "string", "minLength": 1, "maxLength": 160 }, "entry": { "type": "string", "minLength": 1, "maxLength": 512 } } },
              { "type": "object", "additionalProperties": false, "required": ["type", "id", "label", "entry", "rpcMethods"], "properties": { "type": { "const": "application.settingsPage" }, "id": { "$ref": "#/$defs/id" }, "label": { "type": "string", "minLength": 1, "maxLength": 80, "pattern": "^\\S(?:[\\s\\S]*\\S)?$" }, "title": { "type": "string", "minLength": 1, "maxLength": 160, "pattern": "^\\S(?:[\\s\\S]*\\S)?$" }, "entry": { "type": "string", "minLength": 1, "maxLength": 512, "pattern": "^\\S(?:[\\s\\S]*\\S)?$" }, "rpcMethods": { "type": "array", "minItems": 1, "maxItems": 32, "uniqueItems": true, "items": { "$ref": "#/$defs/versioned" } } } },
              { "type": "object", "additionalProperties": false, "required": ["type", "id", "label", "pageId", "rpcMethods"], "properties": { "type": { "enum": ["component.sidePanel", "media.contextAction", "project.contextAction", "project.importProvider", "project.exportProvider", "application.command"] }, "id": { "$ref": "#/$defs/id" }, "label": { "type": "string", "minLength": 1, "maxLength": 80 }, "title": { "type": "string", "minLength": 1, "maxLength": 160 }, "pageId": { "$ref": "#/$defs/id" }, "rpcMethods": { "type": "array", "minItems": 1, "maxItems": 16, "uniqueItems": true, "items": { "$ref": "#/$defs/versioned" } } } }
            ]
          }
        },
        "service": {
          "type": "object", "additionalProperties": false,
          "required": ["protocolVersion", "runtime", "entrypoints", "rpcMethods", "capabilities", "permissions"],
          "properties": {
            "protocolVersion": { "const": 1 },
            "runtime": { "enum": ["node", "executable"] },
            "entrypoints": { "type": "object", "minProperties": 1, "additionalProperties": { "type": "string", "minLength": 1, "maxLength": 512 } },
            "rpcMethods": { "type": "array", "minItems": 1, "maxItems": 128, "uniqueItems": true, "items": { "$ref": "#/$defs/versioned" } },
            "capabilities": { "type": "array", "maxItems": 32, "uniqueItems": true, "items": { "enum": ["project.media.page.v7", "project.media.variants.v7", "project.input.tokens.v7", "project.output.v7", "version.create.v7", "tasks.v7", "dialogs.v7", "component.storage.v7", "component.settings.v7", "component.events.v7", "component.lifecycle.v7", "component.media.v7", "project.progress.v7", "notifications.v7", "project.files.page.v7", "project.files.search.v7", "project.media.metadata.v7", "project.versions.page.v7", "project.version.graph.v7", "project.media.ratings.v7", "project.media.ratings.write.v7", "project.version.update.v7", "project.version.delete.v7", "project.progress.manage.v7", "project.import.v7", "project.files.mutate.v7", "project.media.process.v7", "component.secrets.v7", "network.fetch.v7"] } },
            "permissions": { "type": "array", "maxItems": 32, "uniqueItems": true, "items": { "enum": ["project.media.read", "project.input.read", "project.output.write", "project.version.create", "component.storage", "component.settings", "component.secrets", "network.fetch", "tasks", "dialogs", "events", "component.lifecycle.read", "component.lifecycle.manage", "component.media", "project.progress", "notifications", "project.files.read", "project.versions.read", "project.media.ratings.read", "project.media.ratings.write", "project.version.write", "project.version.delete", "project.progress.manage", "project.import", "project.files.write", "project.media.process"] } },
            "events": { "type": "array", "maxItems": 32, "uniqueItems": true, "items": { "$ref": "#/$defs/versioned" } },
            "runtimeActions": { "type": "array", "maxItems": 32, "uniqueItems": true, "items": { "$ref": "#/$defs/id" } },
            "lifecycleActions": { "type": "object", "maxProperties": 16 },
            "networkOrigins": { "type": "array", "maxItems": 16, "uniqueItems": true, "items": { "type": "string", "pattern": "^https://[^/?#@]+$", "maxLength": 512 } },
            "secretBindings": { "type": "object", "maxProperties": 16, "propertyNames": { "$ref": "#/$defs/id" }, "additionalProperties": { "type": "object", "additionalProperties": false, "required": ["origin", "header"], "properties": { "origin": { "type": "string", "pattern": "^https://[^/?#@\\s]+$", "maxLength": 512 }, "header": { "type": "string", "pattern": "^(?!(?:host|cookie|set-cookie|connection|upgrade|transfer-encoding|proxy-.*)$)[a-z0-9-]{1,64}$" }, "prefix": { "type": "string", "maxLength": 128, "pattern": "^[^\\r\\n]*$" } } } },
            "backupRestore": {
              "type": "object", "additionalProperties": false, "required": ["transactionProtocolVersion", "sourceManifestProtocolVersion", "receiptProtocolVersion", "sources"],
              "properties": {
                "transactionProtocolVersion": { "const": 1 },
                "sourceManifestProtocolVersion": { "const": 1 },
                "receiptProtocolVersion": { "const": 1 },
                "workspace": { "$ref": "#/$defs/backupRestoreHook" },
                "project": { "$ref": "#/$defs/backupRestoreHook" },
                "sources": {
                  "type": "array", "minItems": 1, "maxItems": 16, "uniqueItems": true,
                  "items": {
                    "type": "object", "additionalProperties": false, "required": ["scope", "path", "format"],
                    "properties": {
                      "scope": { "enum": ["component-storage", "domain-database"] },
                      "path": { "type": "string", "minLength": 1, "maxLength": 512, "pattern": "^(?=\\S(?:[\\s\\S]*\\S)?$)(?!/)(?!.*//)(?!.*(?:^|/)\\.{1,2}(?:/|$))[^\\\\/\\u0000-\\u001f]+(?:/[^\\\\/\\u0000-\\u001f]+)*$" },
                      "format": { "type": "string", "minLength": 1, "maxLength": 80, "pattern": "^\\S(?:[\\s\\S]*\\S)?$" }
                    }
                  }
                }
              },
              "anyOf": [{ "required": ["workspace"] }, { "required": ["project"] }]
            },
            "projectFolders": {
              "type": "array", "maxItems": 32,
              "items": {
                "type": "object", "additionalProperties": false, "required": ["name"],
                "properties": {
                  "name": { "type": "string", "minLength": 1, "maxLength": 160, "pattern": "^\\S(?:[\\s\\S]*[^.\\s])?$" },
                  "protectFromGenericRename": { "type": "boolean" },
                  "reserveProgressRelocationName": { "type": "boolean" },
                  "legacyAdoptionGrant": { "enum": ["component.storage.previous.v1", "project.output.existing.v1"] }
                },
                "anyOf": [
                  { "required": ["protectFromGenericRename"], "properties": { "protectFromGenericRename": { "const": true } } },
                  { "required": ["reserveProgressRelocationName"], "properties": { "reserveProgressRelocationName": { "const": true } } }
                ]
              }
            }
          }
        }
      },
      "allOf": [{
        "if": { "properties": { "contributions": { "contains": { "type": "object", "required": ["type"], "properties": { "type": { "const": "application.settingsPage" } } } } } },
        "then": { "properties": { "compatibility": { "properties": { "minHostApiVersion": { "minimum": 7 }, "maxHostApiVersion": { "minimum": 7 } } } } }
      }, {
        "if": { "properties": { "service": { "properties": { "capabilities": { "contains": { "const": "notifications.v7" } } } } } },
        "then": { "properties": { "compatibility": { "properties": { "minHostApiVersion": { "minimum": 7 } } } } }
      }, {
        "if": { "properties": { "service": { "properties": { "permissions": { "contains": { "const": "notifications" } } } } } },
        "then": { "properties": { "compatibility": { "properties": { "minHostApiVersion": { "minimum": 7 } } } } }
      }, {
        "if": { "properties": { "service": { "properties": { "capabilities": { "contains": { "enum": ["project.files.page.v7", "project.files.search.v7", "project.media.metadata.v7", "project.versions.page.v7", "project.version.graph.v7", "project.media.ratings.v7"] } } } } } },
        "then": { "properties": { "compatibility": { "properties": { "minHostApiVersion": { "minimum": 7 } } } } }
      }, {
        "if": { "properties": { "service": { "properties": { "permissions": { "contains": { "enum": ["project.files.read", "project.versions.read", "project.media.ratings.read"] } } } } } },
        "then": { "properties": { "compatibility": { "properties": { "minHostApiVersion": { "minimum": 7 } } } } }
      }, {
        "if": { "properties": { "service": { "properties": { "capabilities": { "contains": { "enum": ["project.media.ratings.write.v7", "project.version.update.v7", "project.version.delete.v7", "project.progress.manage.v7", "project.import.v7", "project.files.mutate.v7", "project.media.process.v7"] } } } } } },
        "then": { "properties": { "compatibility": { "properties": { "minHostApiVersion": { "minimum": 7 } } } } }
      }, {
        "if": { "properties": { "service": { "properties": { "permissions": { "contains": { "enum": ["project.media.ratings.write", "project.version.write", "project.version.delete", "project.progress.manage", "project.import", "project.files.write", "project.media.process"] } } } } } },
        "then": { "properties": { "compatibility": { "properties": { "minHostApiVersion": { "minimum": 7 } } } } }
      }, {
        "if": { "properties": { "contributions": { "contains": { "required": ["type"], "properties": { "type": { "enum": ["component.sidePanel", "media.contextAction", "project.contextAction", "project.importProvider", "project.exportProvider", "application.command"] } } } } } },
        "then": { "properties": { "compatibility": { "properties": { "minHostApiVersion": { "minimum": 7 } } } } }
      }, {
        "if": { "properties": { "service": { "required": ["networkOrigins"] } } },
        "then": { "properties": { "compatibility": { "properties": { "minHostApiVersion": { "minimum": 7 } } } } }
      }, {
        "if": { "properties": { "service": { "required": ["secretBindings"] } } },
        "then": { "properties": { "compatibility": { "properties": { "minHostApiVersion": { "minimum": 7 } } } } }
      }, {
        "if": { "properties": { "service": { "required": ["capabilities"], "properties": { "capabilities": { "contains": { "enum": ["component.secrets.v7", "network.fetch.v7"] } } } } } },
        "then": { "properties": { "compatibility": { "properties": { "minHostApiVersion": { "minimum": 7 } } } } }
      }, {
        "if": { "properties": { "service": { "required": ["permissions"], "properties": { "permissions": { "contains": { "enum": ["component.secrets", "network.fetch"] } } } } } },
        "then": { "properties": { "compatibility": { "properties": { "minHostApiVersion": { "minimum": 7 } } } } }
      }]
    }
  },
  "$defs": {
    "id": { "type": "string", "pattern": "^[A-Za-z0-9][A-Za-z0-9._-]{0,79}$" },
    "versioned": { "type": "string", "pattern": "^[a-z][a-z0-9.-]{0,119}\\.v[1-9][0-9]*$" },
    "backupRestoreHook": {
      "type": "object", "additionalProperties": false, "required": ["method"],
      "properties": { "method": { "allOf": [{ "$ref": "#/$defs/versioned" }, { "maxLength": 128 }] } }
    }
  }
}
