{
  "apiVersion": 1,
  "id": "project-read-v7",
  "version": "1.0.0",
  "componentHost": {
    "contractVersion": 2,
    "compatibility": { "minHostApiVersion": 7, "maxHostApiVersion": 7 },
    "contributions": [
      { "type": "workspace.toolbarAction", "id": "open", "label": "Project Read V7", "pageId": "main" },
      { "type": "component.fullPage", "id": "main", "title": "Project Read V7", "entry": "ui/index.html" }
    ],
    "service": {
      "protocolVersion": 1,
      "runtime": "node",
      "entrypoints": { "default": "service.cjs" },
      "rpcMethods": ["sample.project-files.v1"],
      "capabilities": ["project.files.page.v7"],
      "permissions": ["project.files.read"],
      "events": []
    }
  }
}
