{
  "apiVersion": 1,
  "id": "host-api-v7-example",
  "version": "0.1.0",
  "componentHost": {
    "contractVersion": 2,
    "compatibility": { "minHostApiVersion": 7, "maxHostApiVersion": 7 },
    "contributions": [
      { "type": "workspace.toolbarAction", "id": "open", "label": "API7 示例", "pageId": "main" },
      { "type": "component.fullPage", "id": "main", "title": "API7 示例", "entry": "ui/index.html" },
      { "type": "component.sidePanel", "id": "panel", "label": "示例面板", "pageId": "main", "rpcMethods": ["example.run.v1"] },
      { "type": "media.contextAction", "id": "media", "label": "处理所选媒体", "pageId": "main", "rpcMethods": ["example.run.v1"] },
      { "type": "project.contextAction", "id": "project", "label": "处理项目", "pageId": "main", "rpcMethods": ["example.run.v1"] },
      { "type": "project.importProvider", "id": "import", "label": "示例导入", "pageId": "main", "rpcMethods": ["example.run.v1"] },
      { "type": "project.exportProvider", "id": "export", "label": "示例导出", "pageId": "main", "rpcMethods": ["example.run.v1"] },
      { "type": "application.command", "id": "command", "label": "API7 示例命令", "pageId": "main", "rpcMethods": ["example.run.v1"] }
    ],
    "service": {
      "protocolVersion": 1,
      "runtime": "node",
      "entrypoints": { "default": "service.cjs" },
      "rpcMethods": ["example.run.v1"],
      "capabilities": ["component.secrets.v7", "network.fetch.v7"],
      "permissions": ["component.secrets", "network.fetch"],
      "events": [],
      "networkOrigins": ["https://api.example.com"],
      "secretBindings": { "bearer": { "origin": "https://api.example.com", "header": "authorization", "prefix": "Bearer " } }
    }
  }
}
