{
  "apiVersion": 1,
  "id": "project-write-v7",
  "version": "0.1.0",
  "componentHost": {
    "contractVersion": 2,
    "compatibility": { "minHostApiVersion": 7, "maxHostApiVersion": 7 },
    "contributions": [
      { "type": "workspace.toolbarAction", "id": "open", "label": "V7 写入示例", "pageId": "main" },
      { "type": "component.fullPage", "id": "main", "title": "V7 写入示例", "entry": "ui/index.html" }
    ],
    "service": {
      "protocolVersion": 1,
      "runtime": "node",
      "entrypoints": { "default": "service.cjs" },
      "rpcMethods": ["project-write.rate.v1"],
      "capabilities": ["project.media.ratings.write.v7"],
      "permissions": ["project.media.ratings.write"],
      "events": []
    }
  }
}
